,ID,price,local,areas,bedrooms,parking-spaces,bathrooms,cep
1223,2615008748,220000.0,"Rua Antônio Caetano Sorrentino, Brisamar",75.0,3.0,1.0,,58038-381
1224,2563888093,280000.0,"Rua da Imbiribeira, Anatólia",72.0,3.0,1.0,,58053-045
1225,2615356746,328000.0,"Aeroclube, João Pessoa",50.0,2.0,1.0,,
1226,2571239573,310000.0,"Bancários, João Pessoa",78.0,3.0,1.0,,
1227,2617156374,230000.0,"Rua Presidente Venceslau Braz, Bessa",57.0,2.0,1.0,,
1228,2561768633,500000.0,"Rua Valdemar Chianca, Jardim Oceania",105.0,3.0,,,58037-050
1229,2631999108,234900.0,"Avenida Expedicionários, Torre",51.0,2.0,1.0,,58030-001
1230,2482997267,880000.0,"Ponta dos Seixas, João Pessoa",134.0,3.0,,,58046-010
1231,2623902640,630000.0,"Jardim Oceania, João Pessoa",85.0,3.0,2.0,,
1232,2599730353,210000.0,"Rua Maria das Dores Barbosa Lopes, Industrias",150.0,4.0,,,58081-300
1233,2637731683,170230.0,"Rua das Misericórdias, Ernesto Geisel",57.0,2.0,1.0,,58075-690
1234,2603464977,540000.0,"Avenida Presidente José Linhares, Bessa",69.0,2.0,1.0,,
1235,2581648718,590000.0,"Aeroclube, João Pessoa",132.0,3.0,,,
1236,2627641671,619900.0,"Avenida Ingá, Manaíra",98.0,3.0,2.0,,58038-381
1237,2567343616,990000.0,"Estados, João Pessoa",147.0,3.0,,,
1238,2619632023,250000.0,"Rua Rosa Lima dos Santos, Jardim Cidade Universitária",90.0,3.0,1.0,,58051-810
1239,2631204180,818000.0,"Jardim Oceania, João Pessoa",89.0,2.0,1.0,,
1240,2630499664,340000.0,"Jardim Universitário, Castelo Branco",74.0,3.0,1.0,,86055-645
1241,2614793336,260000.0,"Jardim Cidade Universitária, João Pessoa",54.0,2.0,1.0,,
1242,2558737573,630000.0,"Rodovia BR-230, Brisamar",85.0,3.0,2.0,,58032-100
1243,2585040081,329670.0,"Rua Médica Maria de Lourdes Barbosa Saraiva, Aeroclube",50.0,2.0,1.0,,58036-002
1244,2611889303,660112.0,"Manaíra, João Pessoa",76.0,3.0,,2.0,
1245,2572013036,310000.0,"Rua Albertino Alfredo Araújo Filho, Jardim Oceania",53.0,2.0,1.0,,58035-070
1246,2628939701,984000.0,"Avenida Sapé, Manaíra",164.0,4.0,,,58038-342
1247,2622076055,260000.0,"Rua Paulo Roberto de Souza Acioly, Bessa",67.0,2.0,1.0,,58035-170
1248,2555929845,329574.0,"Rua Lindolfo Gonçalves Chaves, Jardim São Paulo",58.0,1.0,,2.0,58051-085
1249,2555112842,450000.0,"Miramar, João Pessoa",119.0,3.0,,,
1250,2637349870,250000.0,"Manaíra, João Pessoa",98.0,3.0,1.0,,
1251,2629929977,694863.0,"Altiplano Cabo Branco, João Pessoa",95.0,3.0,2.0,,
1252,2579091891,399000.0,"Rua Silvano Domingos de Araújo, Jardim Oceania",63.0,1.0,1.0,,58036-345
1253,2596055454,170000.0,"Rua Luiz Prímola, Jardim Cidade Universitária",48.0,1.0,1.0,,
1254,2558185187,232673.0,"Avenida Osvaldo Cruz, Tambiá",57.0,3.0,1.0,,58025-000
1255,2578985058,550000.0,"Avenida Sapé, Manaíra",95.0,3.0,2.0,,58038-342
1256,2610345822,570000.0,"Miramar, João Pessoa",92.0,3.0,1.0,,
1257,2632790323,95000.0,"Mumbaba, João Pessoa",60.0,2.0,,1.0,
1258,2621392848,246000.0,"Rua Doutor Ephigênio Barbosa da Silva, Jardim Cidade Universitária",58.0,2.0,1.0,,
1259,2622886245,299000.0,"Avenida Governador Argemiro de Figueiredo, Jardim Oceania",46.0,2.0,1.0,,58037-050
1260,2597750797,1349000.0,"Rua Bacharel José de Oliveira Curchatuz, Aeroclube",136.0,3.0,,,58036-460
1261,2637326565,410031.0,"Avenida Sergipe, Estados",64.0,2.0,1.0,,58030-140
1262,2625666708,382514.0,"Rua Juiz José Alfredo Nóbrega de Freitas, Bessa",60.0,2.0,1.0,,
1263,2630427288,998000.0,"Rua Olívio Ribeiro Campos, Miramar",159.0,4.0,,,58043-270
1264,2577478905,480000.0,"Rua Eutiquiano Barreto, Manaíra",115.0,3.0,,,58038-381
1265,2621929684,280591.0,"Avenida Expedicionários, Expedicionários",50.0,2.0,1.0,,38405-040
1266,2599839255,325000.0,"Rua Débora da Silva Braga, Aeroclube",56.0,2.0,1.0,,58036-853
1267,2578775319,350000.0,"Rua Arminda da Cunha Theotônio, Ernesto Geisel",130.0,4.0,,,
1268,2577141714,299925.0,"Rua João Batista Maia, Bancários",53.0,2.0,1.0,,
1269,2638435697,250000.0,"João Paulo II, João Pessoa",319.0,,,,
1270,2558561781,289000.0,"Rua Paulo Roberto de Souza Acioly, Bessa",49.0,2.0,1.0,,58035-170
1271,2559481201,662470.0,"Altiplano Cabo Branco, João Pessoa",99.0,3.0,2.0,,
1272,2631226076,479000.0,"Rua Luiz José Batista, Jardim Cidade Universitária",90.0,3.0,1.0,,58052-170
1273,2636699905,159900.0,"Rua Joaquim Borba Filho, Jardim São Paulo",24.0,1.0,,2.0,58053-045
1274,2628127091,340000.0,"Rua Silvino Xavier Pimentel, Bancários",90.0,3.0,1.0,,58051-085
1275,2624637489,559000.0,"Rua Huerta Ferreira de Melo, Jardim Oceania",64.0,2.0,,2.0,58037-050
1276,2627247139,720000.0,"Rua Iracema Guedes Lins, Altiplano Cabo Branco",73.0,3.0,2.0,,58046-095
1277,2636547856,355000.0,"Anatólia, João Pessoa",73.0,3.0,1.0,,
1278,2584416353,135000.0,"Valentina de Figueiredo, João Pessoa",50.0,2.0,1.0,,58063-300
1279,2631901546,234630.0,"Rua Bancário José Alexandre de Farias, Bancários",54.0,2.0,1.0,,58071-840
1280,2622821975,700000.0,"Praça Estudante Orlando Geisel, Ernesto Geisel",175.0,4.0,,,
1281,2616780095,630000.0,"Brisamar, João Pessoa",164.0,4.0,,,58032-100
1282,2637420972,264900.0,"Ladeira do Jacó, Cristo Redentor",97.0,2.0,1.0,,
1283,2559634968,299000.0,"Rua Presidente Kenedy, Tambauzinho",51.0,2.0,,2.0,
1284,2609535321,248500.0,"Rua Tertuliano Castro, Bessa",51.0,2.0,1.0,,58035-200
1285,2626926562,380000.0,"Avenida Júlia Freire, Torre",75.0,2.0,1.0,,
1286,2628940476,317330.0,"Avenida Marechal Rondon, Treze de Maio",52.0,2.0,1.0,,58025-060
1287,2599509343,270000.0,"Jardim Cidade Universitária, João Pessoa",56.0,2.0,2.0,,
1288,2633340395,360000.0,"Avenida Paraná, Estados",66.0,2.0,1.0,,58030-140
1289,2629084380,294780.0,"Rua Goiás, Estados",60.0,2.0,1.0,,69305-410
1290,2575288130,280000.0,"Rua Deputado Geraldo Mariz, Miramar",72.0,2.0,1.0,,58042-060
1291,2630646386,260000.0,"Cristo Redentor, João Pessoa",78.0,3.0,1.0,,
1292,2617187594,900000.0,"Avenida Governador Flávio Ribeiro Coutinho, Manaíra",233.0,4.0,,,58037-000
1293,2578563834,280000.0,"Expedicionários, João Pessoa",58.0,2.0,1.0,,
1294,2615716896,440000.0,"Rua Antônio Gama, Expedicionários",105.0,3.0,,,58041-110
1295,2631644535,329730.0,"Rua Bancário Amaury de Sousa, Bancários",72.0,3.0,1.0,,58051-400
1296,2628470308,238790.0,"Rua Maria Lilian Dantas da Nóbrega, Aeroclube",56.0,2.0,1.0,,58036-002
1297,2555928494,750000.0,"Rua das Acácias, Miramar",181.0,4.0,,,58043-270
1298,2628806672,479000.0,"Jardim Oceania, João Pessoa",80.0,3.0,1.0,,
1299,2632927651,2300000.0,"Avenida Hilton Souto Maior, José Américo de Almeida",320.0,4.0,,,
1300,2612497445,575900.0,"Rua Doutor Damasquins Ramos Maciel, Bessa",80.0,3.0,2.0,,58035-200
1301,2578563834,280000.0,"Expedicionários, João Pessoa",58.0,2.0,1.0,,
1302,2615716896,440000.0,"Rua Antônio Gama, Expedicionários",105.0,3.0,,,58041-110
1303,2628470308,238790.0,"Rua Maria Lilian Dantas da Nóbrega, Aeroclube",56.0,2.0,1.0,,58036-002
1304,2565202697,146387.0,"Avenida Osvaldo Cruz, Tambiá",47.0,2.0,1.0,,58025-000
1305,2555928494,750000.0,"Rua das Acácias, Miramar",181.0,4.0,,,58043-270
1306,2573974626,169000.0,"Rua Doutor Plínio Lemos, Valentina de Figueiredo",45.0,2.0,1.0,,
1307,2633268825,430000.0,"Brisamar, João Pessoa",51.0,2.0,,2.0,58032-100
1308,2540214607,240000.0,"Bancários, João Pessoa",49.0,2.0,1.0,,
1309,2604798490,205000.0,"Avenida Presidente Epitácio Pessoa, Tambauzinho",36.0,1.0,1.0,,58042-006
1310,2628952757,609860.0,"Rua Manoel Ferreira Machado, Estados",89.0,3.0,1.0,,58025-060
1311,2563489203,250000.0,"Rua Agente Fiscal Walfredo Bezerra da Silveira, Jardim Cidade Universitária",80.0,3.0,1.0,,
1312,2623999492,320000.0,"Altiplano Cabo Branco, João Pessoa",70.0,3.0,1.0,,
1313,2559341489,748000.0,"Manaíra, João Pessoa",158.0,4.0,,,
1314,2592967540,296576.0,"Rua Empresário João Rodrigues Alves, Jardim São Paulo",60.0,2.0,,2.0,58051-085
1315,2594929997,850000.0,"Avenida Governador Flávio Ribeiro Coutinho, Manaíra",167.0,4.0,,,58037-000
1316,2634710510,253000.0,"Rua Walfredo Macedo Brandão, Jardim Cidade Universitária",58.0,2.0,1.0,,58052-430
1317,2559831364,920000.0,"Rua Major Ciraulo, Manaíra",210.0,4.0,,,58038-381
1318,2578507333,175000.0,"Rua Carlos Borromeu de Vasconcelos, Cristo Redentor",56.0,2.0,1.0,,58071-690
1319,2624516433,1000000.0,"Rua Monteiro Lobato, Tambaú",107.0,3.0,,,58045-000
1320,2604777905,260000.0,"Avenida Campos Sales, Bessa",56.0,2.0,1.0,,58035-070
1321,2634840894,253000.0,"Jardim São Paulo, João Pessoa",57.0,2.0,1.0,,58053-045
1322,2630750859,1209060.0,"Avenida João Cirilo da Silva, Altiplano Cabo Branco",110.0,3.0,,,
1323,2626488579,100000.0,"Rua Cícero Soares da Silva, Cuiá",44.0,2.0,1.0,,58074-104
1324,2631442274,229900.0,"Rua Diógenes Chianca, Água Fria",55.0,2.0,1.0,,
1325,2631781897,448000.0,"Rua Engenheiro Luciano Vareda, Manaíra",184.0,3.0,,,
1326,2577957918,160000.0,"Valentina de Figueiredo, João Pessoa",48.0,2.0,1.0,,58063-300
1327,2606598222,199000.0,"Praia de Intermares, Portal do Sol",59.0,1.0,1.0,,
1328,2566855457,998000.0,"Brisamar, João Pessoa",167.0,3.0,,,58032-100
1329,2619316047,169900.0,"Cuiá, João Pessoa",50.0,2.0,1.0,,
1330,2633111104,549000.0,"Rua General Alfredo Floro Cantalice, Bancários",92.0,2.0,1.0,,58051-120
1331,2585578693,380000.0,"Jardim Luna, João Pessoa",62.0,2.0,1.0,,58032-100
1332,2624459840,690000.0,"Expedicionários, João Pessoa",445.0,5.0,,,
1333,2634636932,750000.0,"Bessa, João Pessoa",77.0,2.0,,2.0,
1334,2570280110,418000.0,"Rua Marechal Esperidião Rosas, Expedicionários",70.0,2.0,1.0,,
1335,2567170229,118000.0,"Gramame, João Pessoa",45.0,2.0,1.0,,
1336,2567172689,205000.0,"Portal do Sol, João Pessoa",66.0,3.0,1.0,,
1337,2637860847,293399.0,"Rua Saffa Said Abel da Cunha, Tambauzinho",55.0,2.0,1.0,,58041-110
1338,2571959786,149900.0,"Ernesto Geisel, João Pessoa",47.0,2.0,1.0,,58075-410
1339,2616949079,62070.0,"Rua Patativa do Assaré, Muçumagro",47.0,2.0,1.0,,58062-305
1340,2627418560,500000.0,"Aeroclube, João Pessoa",157.0,3.0,,,
1341,2608582209,220000.0,"Avenida Campos Sales, Bessa",60.0,2.0,1.0,,58035-070
1342,2618760576,305000.0,"Expedicionários, João Pessoa",82.0,3.0,1.0,,
1343,2602056279,670000.0,"Avenida Cabo Branco, Cabo Branco",78.0,3.0,1.0,,58045-000
1344,2624443567,275000.0,"Estados, João Pessoa",110.0,4.0,,,
1345,2628815198,174620.0,"Rua Adonias de Azevedo Araújo, Planalto Boa Esperança",53.0,3.0,1.0,,58063-000
1346,2567176859,158000.0,"Cristo Redentor, João Pessoa",49.0,2.0,1.0,,
1347,2638169538,249900.0,"Avenida Presidente Afonso Pena, Bessa",33.0,1.0,1.0,,58035-200
1348,2605521888,354500.0,"Rua Bancário Sérgio Guerra, Bancários",71.0,2.0,1.0,,58052-170
1349,2545828904,781000.0,"Altiplano Cabo Branco, João Pessoa",92.0,3.0,2.0,,
1350,2606718982,650000.0,"Rua Fernando Luiz Henriques dos Santos, Jardim Oceania",186.0,4.0,,,
1351,2585833835,750000.0,"Geisel, João Pessoa",200.0,4.0,,,58075-410
1352,2579118911,330000.0,"Manaíra, João Pessoa",58.0,2.0,1.0,,
1353,2591222619,450000.0,"Rua Poeta Luiz Raimundo Batista de Carvalho, Jardim Oceania",60.0,2.0,1.0,,58036-345
1354,2607929292,2800000.0,"Avenida Presidente Epitácio Pessoa, Estados",780.0,,,2.0,58030-140
1355,2594287270,750000.0,"Rua Eutiquiano Barreto, Manaíra",102.0,3.0,,,58038-381
1356,2608275466,500000.0,"Avenida Campos Sales, Bessa",120.0,4.0,,,58035-070
1357,2586594242,990000.0,"Avenida Monteiro da Franca, Manaíra",215.0,4.0,,,58038-431
1358,2628954771,239440.0,"Rua das Imburanas, Anatólia",70.0,2.0,1.0,,58052-170
1359,2631944608,680000.0,"Manaíra, João Pessoa",83.0,2.0,2.0,,
1360,2634902486,418000.0,"Rua Marechal Esperidião Rosas, Expedicionários",69.0,2.0,1.0,,
1361,2599669986,299000.0,"Avenida da Fraternidade, Cristo Redentor",200.0,3.0,,,
1362,2591357060,695000.0,"Avenida Adolfo Loureiro França, Cabo Branco",87.0,3.0,1.0,,
1363,2630644273,640000.0,"Rua Iracema Guedes Lins, Altiplano Cabo Branco",72.0,3.0,2.0,,58046-095
1364,2622503070,690000.0,"Rua Major Ciraulo, Manaíra",152.0,3.0,,,58038-381
1365,2611888158,520000.0,"Jardim Oceania, João Pessoa",60.0,2.0,1.0,,
1366,2627818072,770000.0,"Rua Maria Eunice Guimarães Fernandes, Manaíra",156.0,4.0,,,58038-511
1367,2605323676,120000.0,"Rua dos Catolés, Muçumagro",,2.0,1.0,1.0,58062-305
1368,2632882331,285000.0,"Aeroclube, João Pessoa",77.0,3.0,1.0,,
1369,2633111239,661890.0,"Avenida Marechal Hermes da Fonseca, Bessa",78.0,3.0,2.0,,58036-002
1370,2624972517,307200.0,"Rua Josué Guedes Pereira, Bessa",39.0,1.0,1.0,,58035-070
1371,2628811581,147980.0,"Rua Doutor Valdevino Gregório de Andrade, Valentina de Figueiredo",49.0,2.0,1.0,,58063-300
1372,2633106822,610000.0,"Rua Goiás, Estados",96.0,3.0,2.0,,69305-410
1373,2632790472,273000.0,"Rua Praia Bela, Muçumagro",56.0,2.0,1.0,,58067-235
1374,2638278970,350000.0,"Rua João Ernesto Andrade, Ernesto Geisel",180.0,3.0,,,58077-174
1375,2614317495,275000.0,"Avenida Campos Sales, Bessa",51.0,2.0,1.0,,58035-070
1376,2612003973,359000.0,"Avenida Campos Sales, Bessa",54.0,2.0,1.0,,58035-070
1377,2608508081,279900.0,"Rua Carlos Barros, Miramar",74.0,3.0,1.0,,58043-110
1378,2620646746,340000.0,"Avenida Marechal Hermes da Fonseca, Bessa",56.0,2.0,1.0,,58036-002
1379,2637903541,270000.0,"Rua Irmão Antônio Reginaldo, Bessa",102.0,3.0,,,58035-170
1380,2616921510,370000.0,"Rua Petrarca Grisi, Cristo Redentor",75.0,3.0,1.0,,58071-690
1381,2567175697,194900.0,"Cristo Redentor, João Pessoa",52.0,2.0,1.0,,
1382,2631901298,159580.0,"Rua Petrarca Grisi, Cristo Redentor",46.0,2.0,1.0,,58071-690
1383,2625362928,325900.0,"Bessa, João Pessoa",49.0,2.0,,2.0,
1384,2628142750,448000.0,"Rua Engenheiro Luciano Vareda, Manaíra",184.0,3.0,,,
1385,2563021070,220000.0,"Rua Radialista Antônio Assunção, Jardim Cidade Universitária",84.0,3.0,,2.0,58052-287
1386,2629066439,770103.0,"Rua Luiz Edir Queiroz Marinho, Bessa",90.0,3.0,2.0,,
1387,2629141285,306000.0,"Rua Presidente Kenedy, Tambauzinho",49.0,2.0,1.0,,
1388,2608036876,244900.0,"Rua Bancário Sérgio Guerra, Anatólia",,2.0,1.0,2.0,58052-170
1389,2588407528,780000.0,"Rua Severino Venâncio de Souza, Gramame",188.0,4.0,,,58075-690
1390,2628466320,289550.0,"Rua Presidente Kenedy, Tambauzinho",59.0,2.0,1.0,,
1391,2567174612,280000.0,"Centro, João Pessoa",60.0,,2.0,2.0,
1392,2617219351,260000.0,"Rua Tabelião Erinaldo Nunes Oliveira, Jardim Cidade Universitária",80.0,3.0,1.0,,58052-750
1393,2629195376,529700.0,"Rua Doutor Eliseu Lira, Miramar",115.0,3.0,,,
1394,2579129402,200000.0,"Rua Adelaide Novais, Cristo Redentor",81.0,3.0,1.0,,
1395,2567176103,275000.0,"Jardim Cidade Universitária, João Pessoa",55.0,2.0,1.0,,
1396,2608020773,320000.0,"Rua Abdias Gomes de Almeida, Tambauzinho",58.0,2.0,1.0,,
1397,2622539019,235000.0,"Rua Severino Ennes de Atayde, Altiplano Cabo Branco",60.0,2.0,1.0,,
1398,2558200556,550000.0,"Rua Edvaldo Bezerra Cavalcanti Pinho, Cabo Branco",120.0,4.0,,,58046-095
1399,2598908794,165000.0,"Rua Iramir Farias Dalla Barba, Cuiá",57.0,2.0,1.0,,
1400,2636447465,350000.0,"Rua Terezinha de Medeiros Dantas Souza, Aeroclube",53.0,2.0,1.0,,58036-605
1401,2581951795,185000.0,"Rua Cândida Ferreira Nobre, Cidade dos Colibris",71.0,3.0,1.0,,58053-012
1402,2627422382,170000.0,"Rua Luiz Oliveira da Silva, Jardim 13 de Maio",77.0,3.0,1.0,,
1403,2630339267,162650.0,"Avenida Coronel Calixto, Mangabeira",43.0,2.0,1.0,,58056-040
1404,2580496527,650000.0,"Rua Agricultor Sebastião Crisóstimo da Penha, Altiplano Cabo Branco",55.0,2.0,1.0,,
1405,2633021497,953000.0,"João Agripino, João Pessoa",133.0,3.0,,,
1406,2625948071,630000.0,"Jardim Oceania, João Pessoa",62.0,2.0,1.0,,
1407,2638381372,300000.0,"Rua Vicente Ielpo, Bessa",66.0,2.0,1.0,,58035-170
1408,2630084655,305000.0,"Rua Francisco Feitosa Palitot, Aeroclube",50.0,2.0,1.0,,
1409,2572724379,384560.0,"Bessa, João Pessoa",51.0,2.0,1.0,,
1410,2587262345,550000.0,"Rua André Dias, Aeroclube",90.0,3.0,1.0,,58036-440
1411,2625492613,464000.0,"Rua Silvio Almeida, Expedicionários",68.0,,,,58041-020
1412,2624635912,381779.0,"Rua Edgar Sales de Miranda Henrique, Aeroclube",49.0,2.0,1.0,,
1413,2578700374,985000.0,"Avenida Cabo Branco, Cabo Branco",173.0,3.0,,,58045-000
1414,2594550779,530000.0,"Rua Alberto Leal, Brisamar",60.0,2.0,1.0,,58042-006
1415,2638048110,310000.0,"Rua Empresário João Rodrigues Alves, Bancários",70.0,3.0,1.0,,58051-085
1416,2596073620,770000.0,"Avenida Governador Argemiro de Figueiredo, Jardim Oceania",92.0,2.0,1.0,,58037-050
1417,2625859541,430000.0,"Bessa, João Pessoa",65.0,2.0,1.0,,
1418,2545987785,460000.0,"Rua Sebastião Interaminense, Jardim Oceania",125.0,3.0,,,58037-700
1419,2533815839,240000.0,"Rua Coronel Artur Américo Cantalice, Bancários",73.0,3.0,1.0,,58051-120
1420,2623679255,230000.0,"Rua Maria das Neves Cardoso de Souza, Bessa",54.0,2.0,1.0,,58035-170
1421,2624643117,630000.0,"Rua Vicente Ielpo, Bessa",77.0,3.0,2.0,,58035-170
1422,2637597924,669900.0,"Rua José Patrício de Almeida, Jardim Oceania",80.0,3.0,2.0,,58037-700
1423,2599890373,320000.0,"Avenida Franca Filho, Manaíra",80.0,1.0,2.0,,58038-130
1424,2562588575,980000.0,"Rua Monsenhor Walfredo Leal, Tambiá",905.0,,,,58020-500
1425,2638283380,223500.0,"Tambiá, João Pessoa",68.0,3.0,1.0,,58020-500
1426,2564367655,251250.0,"Avenida Alberto de Brito, Jaguaribe",61.0,2.0,,1.0,
1427,2624158820,270000.0,"Altiplano Cabo Branco, João Pessoa",58.0,2.0,1.0,,
1428,2619994024,330000.0,"Avenida Minas Gerais, Estados",98.0,3.0,1.0,,69305-420
1429,2558551593,550000.0,"Rua Anastácio Camilo de Oliveira, Jardim Oceania",87.0,3.0,2.0,,58037-328
1430,2574122920,155000.0,"João Paulo II, João Pessoa",57.0,2.0,1.0,,
1431,2621594718,800000.0,"Estados, João Pessoa",100.0,3.0,,,
1432,2610918777,300000.0,"Rua Doutor Manoel Pequeno da Nóbrega, Altiplano Cabo Branco",65.0,3.0,1.0,,
1433,2619695826,450000.0,"Avenida Marechal Hermes da Fonseca, Bessa",60.0,2.0,1.0,,58036-002
1434,2625839674,60000.0,"Avenida Parque, Distrito Industrial",6000.0,,5.0,,58082-020
1435,2567176883,169900.0,"Cidade dos Colibris, João Pessoa",56.0,2.0,1.0,,58073-314
1436,2633977187,826000.0,"Tambauzinho, João Pessoa",126.0,3.0,,,
1437,2616981382,600000.0,"Rua Doutor Arnaldo Escorel, Tambauzinho",149.0,3.0,,,58042-010
1438,2610053807,298000.0,"Rua Enfermeira Ana Maria Barbosa de Almeida, Jardim Cidade Universitária",73.0,3.0,1.0,,58052-330
1439,2631828272,169900.0,"Rua José do Carmo Lima, Cidade dos Colibris",55.0,2.0,1.0,,
1440,2629057135,235000.0,"Avenida Marechal Hermes da Fonseca, Bessa",62.0,2.0,1.0,,58036-002
1441,85026173,500000.0,"Rua José Clementino de Oliveira, Tambauzinho",127.0,3.0,,,58042-060
1442,2596427314,369000.0,"Bessa, João Pessoa",74.0,2.0,1.0,,
1443,2638284974,252000.0,"Portal do Sol, João Pessoa",54.0,2.0,1.0,,
1444,2567176105,180000.0,"Ernesto Geisel, João Pessoa",82.0,3.0,1.0,,58075-410
1445,2600620371,273630.0,"Rua Francisco Moura, Treze de Maio",65.0,3.0,1.0,,58026-040
1446,2628153813,388000.0,"Avenida Espírito Santo, Estados",128.0,3.0,,,58030-330
1447,2564366891,264420.0,"Rua Professora Nair Paiva dos Santos, Altiplano Cabo Branco",54.0,2.0,,2.0,
1448,2632520108,340000.0,"Rua Presidente Roosevelt, Expedicionários",82.0,3.0,1.0,,
1449,2637601768,399000.0,"Manaíra, João Pessoa",75.0,3.0,1.0,,
1450,2626437715,240000.0,"Avenida Capitão João Freire, Tambauzinho",54.0,2.0,1.0,,
1451,2554005507,320000.0,"Rua Abelardo da Silva Guimarães Barreto, Altiplano Cabo Branco",30.0,,1.0,1.0,58046-095
1452,2623106777,258000.0,"Rua Monsenhor Eusébio Oliveira, Gramame",64.0,3.0,1.0,,
1453,2625887659,350000.0,"Avenida Cajazeiras, Manaíra",90.0,3.0,2.0,,58038-250
1454,2632509180,550000.0,"Rua Flávio de Melo Uchoa, Aeroclube",75.0,3.0,1.0,,58036-853
1455,85026136,159000.0,"Rua Deputado Otávio Mariz Maia, Castelo Branco",36.0,1.0,,1.0,58051-120
1456,2634873056,234900.0,"Expedicionários, João Pessoa",50.0,2.0,1.0,,
1457,2631245954,170000.0,"Rua Professora Maria Ester Bezerra Mesquita, Ipês",60.0,2.0,1.0,,
1458,2616572022,600000.0,"Rua Osvaldo Tavares de Melo, Manaíra",95.0,3.0,2.0,,58038-130
1459,2637450109,155000.0,"Rua Amâncio João dos Santos, Paratibe",61.0,2.0,1.0,,58062-305
1460,2613188001,299000.0,"Bessa, João Pessoa",46.0,2.0,1.0,,
1461,2576739291,165000.0,"Vila Beri, Varjão",49.0,2.0,1.0,,
1462,2608506342,1350000.0,"Miramar, João Pessoa",201.0,3.0,,,
1463,2637081007,295000.0,"Estados, João Pessoa",58.0,2.0,1.0,,
1464,2538217132,449300.0,"Rua Sebastião Queiroz de Carvalho, Altiplano Cabo Branco",450.0,,,,
1465,2567175548,115000.0,"Tambiá, João Pessoa",28.0,,1.0,1.0,58020-500
1466,2580420726,250000.0,"Geisel, João Pessoa",100.0,4.0,,,58075-410
1467,2567174704,350000.0,"Jardim 13 de Maio, João Pessoa",73.0,3.0,1.0,,07500-000
1468,2630701210,620000.0,"Jardim Oceania, João Pessoa",94.0,3.0,2.0,,
1469,2555929550,1400000.0,"Avenida Governador Argemiro de Figueiredo, Bessa",140.0,2.0,,,58035-070
1470,2579261316,800000.0,"Rua Severino Venâncio de Souza, Gramame",188.0,4.0,,,58075-690
1471,2577486943,1650000.0,"Rua Ana Guedes Vasconcelos, Altiplano Cabo Branco",175.0,3.0,,,58046-095
1472,2637766473,750000.0,"Tambauzinho, João Pessoa",300.0,3.0,,,
1473,2611251737,258000.0,"Rua Osiris de Belli, Cabo Branco",20.0,1.0,,1.0,58046-095
1474,2579968311,180000.0,"Jaguaribe, João Pessoa",53.0,2.0,1.0,,
1475,2605994581,260000.0,"Rua José Bartolomeu Cabral, Bessa",54.0,2.0,1.0,,58035-200
1476,2549237035,168000.0,"Rua Paulo Afonso, Jaguaribe",55.0,2.0,1.0,,58015-435
1477,2629562656,244000.0,"Rua Presidente Ranieri Mazilli, Cristo Redentor",65.0,2.0,2.0,,58071-000
1478,2594585555,790000.0,"Rua Eutiquiano Barreto, Manaíra",258.0,3.0,,,58038-381
1479,2567176169,149500.0,"Jardim Cidade Universitária, João Pessoa",60.0,2.0,1.0,,
1480,2610793780,400000.0,"Manaíra, João Pessoa",84.0,3.0,1.0,,
1481,2624157131,550000.0,"Jardim Oceania, João Pessoa",95.0,2.0,2.0,,
1482,2604754136,200000.0,"Avenida Juarez Távora, Torre",80.0,3.0,1.0,,58040-720
1483,2611526235,690000.0,"Rua Silvino Chaves, Manaíra",158.0,4.0,,,58038-381
1484,2572452453,298000.0,"Jardim Cidade Universitária, João Pessoa",76.0,3.0,1.0,,
1485,2592115578,520000.0,"Rua Coronel Miguel Satyro, Cabo Branco",60.0,2.0,1.0,,
1486,2637404617,572787.0,"Rua Artur Monteiro Paiva, Bessa",60.0,3.0,1.0,,
1487,2551727938,230000.0,"Rua Oceane Nascimento da Silva, Gramame",140.0,3.0,,,58075-690
1488,2557054332,491535.0,"Rua Vicente Ielpo, Bessa",60.0,2.0,1.0,,58035-170
1489,2631901283,171930.0,"Rua São Miguel Arcanjo, João Paulo II",54.0,2.0,1.0,,58075-690
1490,2635539415,890000.0,"Rua José Brasilino Leite, João Agripino",148.0,4.0,,,58038-381
1491,2629935027,170000.0,"José Américo de Almeida, João Pessoa",54.0,2.0,1.0,,58071-000
1492,2562587899,250000.0,"Avenida Senador Ruy Carneiro, Brisamar",40.0,,1.0,1.0,58032-090
1493,2567584869,210000.0,"Avenida Presidente Afonso Pena, Bessa",18.0,1.0,,1.0,58035-200
1494,2555930514,534000.0,"Rua Huerta Ferreira de Melo, Jardim Oceania",61.0,2.0,1.0,,58037-050
1495,2573377683,310000.0,"Jardim Oceania, João Pessoa",51.0,2.0,1.0,,
1496,2578113194,320000.0,"Rua Ambrosina Soares dos Santos, Bessa",76.0,3.0,1.0,,58035-200
1497,2558551416,879000.0,"Avenida Governador Argemiro de Figueiredo, Jardim Oceania",66.0,3.0,1.0,,58037-050
1498,2619687848,599000.0,"Avenida Cabo Branco, Cabo Branco",42.0,1.0,,1.0,58045-000
1499,2622878350,985000.0,"Avenida Cabo Branco, Cabo Branco",173.0,4.0,,,58045-000
1500,2629026585,890000.0,"Avenida Antônio Lira, Cabo Branco",114.0,3.0,,,58045-000
1501,2610612733,850000.0,"Rua Francisco Claudino Pereira, Manaíra",168.0,3.0,,,58038-431
1502,2624000679,720000.0,"Rua Carmem Romero, Jardim Oceania",127.0,3.0,,,58037-328
1503,2637302286,259900.0,"Avenida Expedicionários, Torre",50.0,3.0,1.0,,58030-001
1504,2638512729,349000.0,"Avenida Governador Argemiro de Figueiredo, Jardim Oceania",22.0,1.0,,1.0,58037-050
1505,2555928694,814544.0,"Rua Edgar de Albuquerque Lins, Altiplano Cabo Branco",65.0,2.0,,2.0,
1506,2637427931,248500.0,"Rua Oswaldo Evaristo da Costa, Ipês",51.0,2.0,1.0,,
1507,2618766960,680000.0,"Manaíra, João Pessoa",96.0,3.0,2.0,,
1508,2631776661,178760.0,"Rua dos Quilombos, Paratibe",47.0,2.0,1.0,,
1509,2562192582,420000.0,"Rua Antônio Franciscano do Amaral, Altiplano Cabo Branco",95.0,4.0,1.0,,
1510,2625726916,629390.0,"Avenida Jacinto Dantas, Manaíra",78.0,3.0,2.0,,58038-250
1511,2626019857,215000.0,"Rua Ex-Combatente Assis Luís, João Paulo II",65.0,2.0,1.0,,
1512,2564913983,640000.0,"Rua Silvino Chaves, Manaíra",83.0,2.0,1.0,,58038-381
1513,2635211278,449000.0,"Jardim São Paulo, João Pessoa",98.0,3.0,1.0,,58053-045
1514,2638431620,900000.0,"Anatólia, João Pessoa",672.0,,,,
1515,2624576099,550000.0,"Rua Oceano Atlântico, Jardim Oceania",66.0,2.0,1.0,,58037-700
1516,2628466318,289040.0,"Rua Presidente Kenedy, Tambauzinho",55.0,2.0,1.0,,
1517,2629185525,406405.0,"Rua Sandoval de Oliveira, Torre",90.0,3.0,2.0,,58013-420
1518,2574203000,180000.0,"Rua Isabel Gomes de Lima, Valentina de Figueiredo",240.0,2.0,,,58063-300
1519,2629066119,470650.0,"Rua Sidney Clemente Dore, Tambaú",50.0,2.0,1.0,,58039-230
1520,2638573321,110000.0,"Cidade dos Colibris, João Pessoa",45.0,2.0,,1.0,58073-314
1521,2621403076,690000.0,"Avenida Índio Arabutan, Cabo Branco",65.0,2.0,1.0,,58045-000
1522,2580627686,344000.0,"Rua Agricultor Sebastião Crisóstimo da Penha, Altiplano Cabo Branco",39.0,1.0,1.0,,
1523,2583662915,230000.0,"Rua Alcebíades da Cunha, Bancários",52.0,2.0,1.0,,58051-085
1524,2631475253,320000.0,"Avenida Coronel José Maurício da Costa, Brisamar",64.0,2.0,1.0,,58032-090
1525,2589804228,2200000.0,"Rua Agricultor Sebastião Crisóstimo da Penha, Altiplano Cabo Branco",381.0,5.0,,,
1526,2629085091,294430.0,"Rua Goiás, Estados",60.0,2.0,1.0,,69305-410
1527,2611884803,372000.0,"Jardim Oceania, João Pessoa",48.0,2.0,1.0,,
1528,2636291872,1900000.0,"Avenida Cabo Branco, Cabo Branco",114.0,3.0,,,58045-000
1529,2573717028,189990.0,"Cristo Redentor, João Pessoa",53.0,2.0,1.0,,
1530,2630337879,342666.0,"Rua Juiz José Alfredo Nóbrega de Freitas, Bessa",55.0,2.0,1.0,,
