,ID,price,local,areas,bedrooms,parking-spaces,bathrooms,cep
2145,2622730237,299000.0,"Jardim Oceania, João Pessoa",92.0,3.0,1.0,,
2146,2573060737,155000.0,"José Américo de Almeida, João Pessoa",50.0,2.0,1.0,,58071-000
2147,2624579354,344900.0,"Anatólia, João Pessoa",69.0,3.0,1.0,,
2148,2589088759,230000.0,"Bancários, João Pessoa",50.0,1.0,1.0,,
2149,2583346567,210000.0,"Portal do Sol, João Pessoa",41.0,2.0,1.0,,
2150,2628956608,434210.0,"Avenida Pombal, Manaíra",52.0,2.0,1.0,,58038-242
2151,2611512573,740000.0,"Rua Eutiquiano Barreto, Manaíra",202.0,3.0,,,58038-381
2152,2559522470,434000.0,"Avenida João Cirilo da Silva, Altiplano Cabo Branco",64.0,2.0,1.0,,
2153,2580008639,650000.0,"Avenida Adolfo Loureiro França, Cabo Branco",51.0,2.0,1.0,,
2154,2634255911,720900.0,"Avenida Bahia, Estados",103.0,3.0,,,58030-330
2155,2599162789,238000.0,"Rua Adalgisa Luna de Menezes, Bancários",56.0,2.0,1.0,,58071-840
2156,2634712407,158900.0,"Rua Gumercindo Leite Sobrinho, Planalto Boa Esperança",56.0,2.0,1.0,,58065-081
2157,2618767196,550000.0,"Jardim Oceania, João Pessoa",117.0,3.0,,,
2158,2578112742,495000.0,"Avenida Governador Flávio Ribeiro Coutinho, Jardim Oceania",72.0,2.0,1.0,,58038-142
2159,2635402964,649900.0,"Rua Radialista Horácio Leal Polari, Miramar",115.0,3.0,,,
2160,2619248321,290000.0,"Altiplano Cabo Branco, João Pessoa",72.0,3.0,1.0,,
2161,2624310520,180000.0,"Rua Horácio Trajano de Oliveira, Cristo Redentor",80.0,3.0,1.0,,58071-000
2162,2589851900,457000.0,"Rua Norberto de Castro Nogueira, Jardim Oceania",58.0,2.0,1.0,,58037-050
2163,2628953877,549230.0,"Rua Presidente Roosevelt, Expedicionários",96.0,4.0,1.0,,
2164,2624582533,730000.0,"Rua Francisco Carneiro de Araújo, Cabo Branco",114.0,3.0,,,
2165,2625778777,750000.0,"Avenida Adolfo Loureiro França, Cabo Branco",201.0,4.0,,,
2166,2623483494,860000.0,"Avenida Maria Rosa, Manaíra",200.0,4.0,,,58038-342
2167,2600940094,154900.0,"Rua Aposentada Severina Xavier de Carvalho, Gramame",60.0,2.0,1.0,,58065-081
2168,2628950917,273130.0,"Rua Francisco Moura, Treze de Maio",65.0,3.0,1.0,,58026-040
2169,2562276156,230000.0,"Rua Presidente Nilo Peçanha, Bessa",53.0,2.0,1.0,,
2170,2631474164,310000.0,"Rua Francisco Brandão, Manaíra",70.0,2.0,1.0,,58038-381
2171,2560400119,1600000.0,"Tambaú, João Pessoa",231.0,4.0,,,
2172,2636171759,310000.0,"Rua Eliane Coutinho de Oliveira, Brisamar",59.0,2.0,,2.0,58038-381
2173,2611034494,339000.0,"Bessa, João Pessoa",60.0,2.0,1.0,,
2174,2604177338,633000.0,"Rua Josué Guedes Pereira, Bessa",80.0,3.0,2.0,,58035-070
2175,2618368281,1000000.0,"Rua João Gabriel de França Dias, Ernesto Geisel",200.0,4.0,,,
2176,2625762423,925539.0,"Avenida Cabo Branco, Cabo Branco",64.0,2.0,2.0,,58045-000
2177,2623653391,736000.0,"Rua Monteiro Lobato, Tambaú",62.0,2.0,1.0,,58045-000
2178,2629141285,306000.0,"Rua Presidente Kenedy, Tambauzinho",49.0,2.0,1.0,,
2179,2629066116,514800.0,"Rua Sidney Clemente Dore, Tambaú",50.0,2.0,1.0,,58039-230
2180,2618556425,560000.0,"Jardim Oceania, João Pessoa",62.0,2.0,1.0,,
2181,2613841622,580000.0,"Cabo Branco, João Pessoa",62.0,2.0,1.0,,
2182,2628816271,319390.0,"Rua Tertuliano Castro, Bessa",70.0,3.0,1.0,,58035-200
2183,2589344814,240000.0,"Avenida Antônio Lira, Tambaú",37.0,1.0,1.0,,58039-010
2184,2623951460,235000.0,"Rua Oswaldo Evaristo da Costa, Estados",67.0,3.0,1.0,,
2185,2622424913,585999.0,"Avenida Cabo Branco, Cabo Branco",45.0,2.0,1.0,,58045-000
2186,2632792411,1000000.0,"Centro, João Pessoa",500.0,,,,
2187,2596144819,600000.0,"Rua Escrivão Sebastião de Azevedo Bastos, Manaíra",90.0,3.0,2.0,,
2188,2625734398,268960.0,"Rua Saffa Said Abel da Cunha, Tambauzinho",58.0,2.0,1.0,,58041-110
2189,2593072138,314900.0,"Tambauzinho, João Pessoa",62.0,2.0,1.0,,
2190,2620844514,640000.0,"Rua Sidney Clemente Dore, Tambaú",60.0,2.0,1.0,,58039-230
2191,2629302273,370000.0,"Rua Presidente Ranieri Mazilli, Cristo Redentor",80.0,3.0,2.0,,58071-000
2192,2624584213,520000.0,"Avenida Maria Rosa, Manaíra",80.0,2.0,2.0,,58038-342
2193,2631901806,649710.0,"Rua Maria Elizabeth, Cabo Branco",64.0,2.0,1.0,,58046-095
2194,2631392912,159900.0,"Rua Cecília Rodrigues Siqueira, Jardim Cidade Universitária",80.0,3.0,1.0,,58052-170
2195,2634217492,264900.0,"Avenida Umbuzeiro, Manaíra",30.0,1.0,1.0,,58038-130
2196,2622812690,539900.0,"Rua Doutor Agrícola Montenegro, Miramar",127.0,4.0,,,
2197,2611380505,220000.0,"Rua Seráfico da Nóbrega, Jaguaribe",59.0,2.0,,2.0,58015-020
2198,2629077903,2049130.0,"Rua das Acácias, Miramar",407.0,5.0,,,58043-270
2199,2550335559,553000.0,"Brisamar, João Pessoa",84.0,3.0,2.0,,58032-100
2200,2619514354,1300000.0,"Cabo Branco, João Pessoa",200.0,3.0,,,
2201,2575311849,610000.0,"Rua Silvino Chaves, Manaíra",128.0,3.0,,,58038-381
2202,2576408113,370000.0,"Cabo Branco, João Pessoa",44.0,2.0,1.0,,
2203,2638574783,860000.0,"Rua Presidente Venceslau Braz, Bessa",220.0,4.0,,,
2204,2628470104,197390.0,"Rua Farmacêutico Severino Cabral de Lucena, Portal do Sol",42.0,2.0,1.0,,
2205,2557878700,190000.0,"Rua Bancário Sérgio Guerra, Anatólia",58.0,2.0,1.0,,58052-170
2206,2630220664,478000.0,"Rua Professora Luzia Simões Bartolini, Aeroclube",128.0,3.0,,,
2207,2530490506,667800.0,"Rua Nossa Senhora dos Navegantes, Tambaú",68.0,,1.0,1.0,
2208,2624456183,241000.0,"Castelo Branco, João Pessoa",40.0,1.0,1.0,,
2209,2626480861,270000.0,"Avenida Marechal Hermes da Fonseca, Bessa",72.0,3.0,1.0,,58036-002
2210,2567175237,140000.0,"Planalto Boa Esperança, João Pessoa",54.0,2.0,1.0,,58065-081
2211,2621468161,190000.0,"Rua Escritor Ramalho Leite, Muçumagro",200.0,,,,
2212,2555596842,421006.0,"Manaíra, João Pessoa",54.0,2.0,1.0,,
2213,2613908496,340000.0,"Avenida Antônio Lira, Tambaú",30.0,1.0,1.0,,58039-010
2214,2580102000,505000.0,"Rua Francisco Carneiro de Araújo, Cabo Branco",44.0,2.0,1.0,,
2215,2618461697,650000.0,"Bessa, João Pessoa",85.0,3.0,2.0,,
2216,2628955624,418760.0,"Avenida Pombal, Manaíra",52.0,2.0,1.0,,58038-242
2217,2608991199,779000.0,"Tambaú, João Pessoa",55.0,2.0,1.0,,
2218,2562770009,482776.0,"Rua Professora Maria Sales, Tambaú",41.0,1.0,,2.0,58045-000
2219,2620730567,190000.0,"Cristo Redentor, João Pessoa",60.0,3.0,1.0,,
2220,2632400522,279540.0,"Avenida Presidente Washington Luiz, Bessa",45.0,1.0,1.0,,
2221,2606329563,120000.0,"Rua dos Catolés, Muçumagro",50.0,2.0,1.0,,58062-305
2222,2635244780,155000.0,"Rua da Ação, Industrias",48.0,2.0,1.0,,58081-300
2223,2537339366,470000.0,"Manaíra, João Pessoa",120.0,3.0,,,
2224,2622509242,420000.0,"Brisamar, João Pessoa",76.0,3.0,2.0,,58032-100
2225,2628948966,619110.0,"Avenida Severino Massa Spinelli, Tambaú",89.0,3.0,2.0,,
2226,2637965631,630000.0,"Rua Professora Maria Jacy Pinto Costa, Jardim Oceania",82.0,3.0,2.0,,
2227,2575316700,978000.0,"Rua Doutor Agenor Lacet, João Agripino",133.0,3.0,,,58038-381
2228,2632789647,1247000.0,"Altiplano Cabo Branco, João Pessoa",127.0,3.0,,,
2229,2636673501,570000.0,"Rua Napoleão Gomes Varela, Bessa",75.0,3.0,2.0,,58035-170
2230,2604828296,650000.0,"Avenida Antônio Lira, Cabo Branco",114.0,3.0,,,58045-000
2231,2638284078,480000.0,"Manaíra, João Pessoa",90.0,3.0,2.0,,
2232,2630424956,970000.0,"Rua Escritor Ramalho Leite, Muçumagro",173.0,3.0,,,
2233,2617608567,370000.0,"Rua Doutor Hortêncio Osterne Carneiro, Bessa",132.0,4.0,,,
2234,2566854115,330000.0,"Rua Francisca Dantas Souza, Jardim Cidade Universitária",82.0,3.0,2.0,,58052-430
2235,2604922982,215000.0,"Rua Desportista José Eduardo de Holanda, Cabo Branco",19.0,1.0,,1.0,58046-095
2236,2629051696,680000.0,"Rua Alice Almeida, Cabo Branco",150.0,4.0,,,58046-005
2237,2628466293,268060.0,"Rua Presidente Kenedy, Tambauzinho",59.0,2.0,1.0,,
2238,2613730443,1200000.0,"Jardim Oceania, João Pessoa",138.0,2.0,,,
2239,2636961771,299000.0,"Rua Doutor Arnaldo Escorel, Tambauzinho",51.0,2.0,1.0,,58042-010
2240,2623952334,835007.0,"Rua Francisco Beltrão, Bessa",77.0,3.0,2.0,,
2241,2611015744,1000000.0,"Rua Antônio Martins dos Santos, Muçumagro",170.0,4.0,,,58067-235
2242,2563553758,686250.0,"Rua Norberto de Castro Nogueira, Jardim Oceania",92.0,3.0,,2.0,58037-050
2243,2562728911,299900.0,"Jardim Oceania, João Pessoa",56.0,2.0,1.0,,
2244,2623278017,505000.0,"Praça José Tomás de Souza, Jardim Oceania",65.0,2.0,1.0,,
2245,2557878417,270000.0,"Avenida Presidente Castelo Branco, Castelo Branco",56.0,2.0,1.0,,58043-110
2246,2584535973,140000.0,"Rua Abelardo do Rego, Mangabeira",45.0,2.0,1.0,,58056-040
2247,2589228451,139900.0,"João Paulo II, João Pessoa",57.0,2.0,1.0,,
2248,2621496328,435000.0,"Avenida Manoel Morais, Manaíra",56.0,2.0,,2.0,58038-381
2249,2620544235,1500000.0,"Brisamar, João Pessoa",183.0,3.0,,,58032-100
2250,2563682165,699000.0,"Rua Deputado José Mariz, Tambauzinho",129.0,3.0,,,58042-006
2251,2611888839,319000.0,"Bessa, João Pessoa",64.0,2.0,,2.0,
2252,2616296694,245000.0,"Avenida Santa Catarina, Estados",55.0,2.0,1.0,,88330-116
2253,2630913267,319780.0,"Rua Presidente Kenedy, Tambauzinho",51.0,2.0,1.0,,
2254,2637016202,278350.0,"Rua Maria Lilian Dantas da Nóbrega, Aeroclube",74.0,3.0,1.0,,58036-002
2255,2567173343,175000.0,"Anatólia, João Pessoa",70.0,3.0,1.0,,
2256,2628370162,150000.0,"Rua João de Souza Filho, Cuiá",55.0,2.0,1.0,,58075-690
2257,2574445124,229000.0,"Avenida Cabo Branco, Cabo Branco",17.0,1.0,1.0,,58045-000
2258,2614834304,735000.0,"Portal do Sol, João Pessoa",,,,,
2259,2626307335,950000.0,"Avenida Cajazeiras, Manaíra",280.0,3.0,,,58038-250
2260,2626085268,470000.0,"Miramar, João Pessoa",110.0,3.0,,,
2261,2632790039,750000.0,"Avenida João Cirilo da Silva, Altiplano Cabo Branco",70.0,2.0,,2.0,
2262,2567174043,245250.0,"Bessa, João Pessoa",55.0,2.0,1.0,,
2263,2614996908,1350000.0,"Rodovia BR-230, Cabo Branco",218.0,4.0,,,
2264,2570107761,185000.0,"Tambauzinho, João Pessoa",36.0,,1.0,1.0,
2265,2573976584,99000.0,"Avenida Almirante Barroso, Centro",27.0,,,1.0,58013-130
2266,2610512053,440000.0,"Jardim Oceania, João Pessoa",117.0,3.0,,,
2267,2521120101,1600000.0,"Rua Monteiro Lobato, Tambaú",136.0,3.0,,,58045-000
2268,2631762438,465000.0,"Avenida Presidente Epitácio Pessoa, Cabo Branco",135.0,3.0,,,58045-000
2269,2634264390,1450000.0,"Rua Maria de Lourdes Coutinho Torres, Altiplano Cabo Branco",216.0,4.0,,,
2270,2636382063,800000.0,"Bessa, João Pessoa",258.0,4.0,,,
2271,2624517454,630000.0,"Avenida Cabo Branco, Cabo Branco",52.0,2.0,1.0,,58045-000
2272,2573975422,134000.0,"Rua Agú Rodrigues dos Santos, Paratibe",45.0,2.0,1.0,,58062-349
2273,2628954981,249200.0,"Rua Ana de Fátima Gama Cabral, Portal do Sol",55.0,2.0,1.0,,
2274,2628955272,494530.0,"Avenida Pombal, Manaíra",60.0,3.0,1.0,,58038-242
2275,2631906434,751820.0,"Rua Ariosvaldo Alves de Azevedo, Jardim Oceania",90.0,3.0,2.0,,
2276,2583200809,209000.0,"Bancários, João Pessoa",54.0,2.0,1.0,,
2277,2608584278,550000.0,"Avenida Campos Sales, Bessa",61.0,2.0,1.0,,58035-070
2278,2557876295,150000.0,"Rua Adalgisa Carneiro Carvalho, Cuiá",50.0,2.0,1.0,,
2279,2628095655,2300000.0,"Avenida Hilton Souto Maior, Portal do Sol",320.0,4.0,,,58052-287
2280,2633373135,238000.0,"Bessa, João Pessoa",15.0,1.0,1.0,,
2281,2604209616,660000.0,"Rua Monteiro Lobato, Tambaú",110.0,3.0,,,58045-000
2282,2629318389,210000.0,"Rua das Colinas, Gramame",66.0,3.0,2.0,,58075-690
2283,2638284969,880000.0,"João Agripino, João Pessoa",148.0,4.0,,,
2284,2567173920,450000.0,"Aeroclube, João Pessoa",114.0,3.0,,,
2285,2634438508,260000.0,"Praça Santo Antônio, Tambaú",30.0,1.0,1.0,,13710-000
2286,2632790993,990000.0,"Rua Escrivão Sebastião de Azevedo Bastos, Manaíra",213.0,4.0,,,
2287,2591040369,250000.0,"Rua Antonio Cavalcanti de Albuquerque, Bessa",56.0,2.0,1.0,,
2288,2631776758,178600.0,"Rua dos Quilombos, Paratibe",47.0,2.0,1.0,,
2289,2621490219,530000.0,"Miramar, João Pessoa",60.0,2.0,2.0,,
2290,2619039511,630000.0,"Jardim Oceania, João Pessoa",74.0,3.0,1.0,,
2291,2618202702,560000.0,"Avenida Presidente Epitácio Pessoa, Miramar",129.0,3.0,,,58032-090
2292,2638377282,245000.0,"Rua Orlando Falcone de Oliveira, Portal do Sol",58.0,2.0,1.0,,58052-287
2293,2535445843,200000.0,"Avenida Desembargador Pinho, Cruz das Armas",80.0,2.0,1.0,,58085-000
2294,2638568544,430000.0,"Rua Francisco Brandão, Manaíra",83.0,3.0,1.0,,58038-381
2295,2638095560,500000.0,"Aeroclube, João Pessoa",90.0,3.0,2.0,,
2296,2625284863,430000.0,"Rua Rosalinda Jurema, Brisamar",59.0,2.0,1.0,,58032-100
2297,2629222677,520000.0,"Rua Doutor Agrícola Montenegro, Miramar",115.0,4.0,,,
2298,2576492408,670000.0,"Avenida João Cirilo da Silva, Altiplano Cabo Branco",69.0,2.0,2.0,,
2299,2626159609,400000.0,"Rua Francisco Brandão, Manaíra",94.0,3.0,1.0,,58038-381
2300,2628951873,299220.0,"Rua Marechal Esperidião Rosas, Expedicionários",60.0,2.0,1.0,,
2301,2560808969,720000.0,"Cabo Branco, João Pessoa",56.0,2.0,1.0,,
2302,2630856304,849000.0,"Avenida Governador Flávio Ribeiro Coutinho, Aeroclube",144.0,3.0,,,58038-511
2303,2626964143,148900.0,"Rua João Alves Rodrigues, Valentina de Figueiredo",49.0,2.0,1.0,,58063-300
2304,2619147041,220000.0,"Rua Carteiro Olívio Pontes, Bancários",77.0,3.0,2.0,,
2305,2559830615,145000.0,"Rua Maria José Ferreira da Silva, Tambiá",59.0,2.0,,1.0,
2306,2591774279,1324823.0,"Avenida Cabo Branco, Cabo Branco",55.0,2.0,2.0,,58045-000
2307,2638102474,430000.0,"Aeroclube, João Pessoa",75.0,3.0,1.0,,
2308,2558737518,323000.0,"Rua Huerta Ferreira de Melo, Jardim Oceania",30.0,1.0,1.0,,58037-050
2309,2623865478,780000.0,"Manaíra, João Pessoa",175.0,4.0,,,
2310,2627269966,230000.0,"Avenida Capitão João Freire, Tambauzinho",57.0,2.0,1.0,,
2311,2559829815,360000.0,"Rua Severino Pereira de Araújo, Manaíra",68.0,3.0,1.0,,58038-342
2312,2606290475,699000.0,"Rua Empresário João Rodrigues Alves, Jardim São Paulo",126.0,3.0,,,58051-085
2313,2637136603,667873.0,"Rua José Ramalho Brunet, Cabo Branco",59.0,2.0,1.0,,58046-095
2314,2622593130,250000.0,"Avenida Ministro José Américo de Almeida, Tambauzinho",77.0,3.0,1.0,,58042-006
2315,2624637156,791250.0,"Rua Norberto de Castro Nogueira, Jardim Oceania",92.0,2.0,1.0,,58037-050
2316,2617480642,360000.0,"Tambaú, João Pessoa",34.0,1.0,1.0,,
2317,2610047668,390000.0,"Avenida Senador Ruy Carneiro, Manaíra",86.0,3.0,1.0,,58039-160
2318,2611493906,272569.0,"Rua Escritora Rosilda Cartaxo, Bessa",19.0,1.0,1.0,,
2319,2622827720,650000.0,"Rua Professora Maria Sales, Tambaú",87.0,3.0,1.0,,58045-000
2320,2632176363,365000.0,"Bessa, João Pessoa",70.0,3.0,1.0,,
2321,2597416982,1350000.0,"Rua Custódio Domingos dos Santos, Brisamar",162.0,4.0,,,58032-100
2322,2630098454,294390.0,"Rua Coronel Aristarco Pessoa, Jaguaribe",72.0,3.0,2.0,,58015-020
2323,2629084480,179650.0,"Rua Paulino dos Santos Coelho, Jardim Cidade Universitária",64.0,2.0,1.0,,58055-010
2324,2556673022,505000.0,"Rua Goiás, Estados",96.0,2.0,1.0,,69305-410
2325,2629981782,340000.0,"Rua Rejane Freire Correia, Bancários",126.0,2.0,,,
2326,2632792293,135000.0,"Valentina de Figueiredo, João Pessoa",58.0,2.0,,1.0,58063-300
2327,2549011418,781281.0,"Rua Plácido de Azevedo Ribeiro, Altiplano Cabo Branco",91.0,3.0,2.0,,58046-095
2328,2592987824,1200000.0,"Avenida Cabo Branco, Cabo Branco",87.0,2.0,1.0,,58045-000
2329,2632792779,189900.0,"Cristo Redentor, João Pessoa",78.0,3.0,,1.0,
2330,2592324481,115210.0,"Rua Valdemar Naziazeno, Ernesto Geisel",44.0,2.0,1.0,,
2331,2623423342,272958.0,"Avenida Governador Argemiro de Figueiredo, Bessa",20.0,1.0,1.0,,58035-070
2332,2629077903,2049130.0,"Rua das Acácias, Miramar",407.0,5.0,,,58043-270
2333,2624515166,1200000.0,"Avenida Antônio Lira, Cabo Branco",240.0,4.0,,,58045-000
2334,2637896100,1179000.0,"Praça Jardim Luna, Jardim Luna",166.0,4.0,,,
2335,2619514354,1300000.0,"Cabo Branco, João Pessoa",200.0,3.0,,,
2336,2625969473,441540.0,"Avenida Governador Argemiro de Figueiredo, Jardim Oceania",40.0,1.0,1.0,,58037-050
2337,2575311849,610000.0,"Rua Silvino Chaves, Manaíra",128.0,3.0,,,58038-381
2338,2576408113,370000.0,"Cabo Branco, João Pessoa",44.0,2.0,1.0,,
2339,2638574783,860000.0,"Rua Presidente Venceslau Braz, Bessa",220.0,4.0,,,
2340,2527052330,210000.0,"Rua Capitão Antônio Mendes de Souza Neto, Miramar",36.0,1.0,1.0,,
2341,2628470104,197390.0,"Rua Farmacêutico Severino Cabral de Lucena, Portal do Sol",42.0,2.0,1.0,,
2342,2557878700,190000.0,"Rua Bancário Sérgio Guerra, Anatólia",58.0,2.0,1.0,,58052-170
2343,2624638475,374900.0,"Rua Tabelião José Ramalho Leite, Cabo Branco",25.0,1.0,1.0,,58046-095
2344,2637101766,414000.0,"Jardim Oceania, João Pessoa",51.0,2.0,1.0,,
2345,2578465189,432236.0,"Rua Anastácio Camilo de Oliveira, Jardim Oceania",60.0,1.0,1.0,,58037-328
2346,2555929870,313000.0,"Rua Doutor José Aloysio da Costa Machado, Aeroclube",54.0,2.0,,2.0,
2347,2567175237,140000.0,"Planalto Boa Esperança, João Pessoa",54.0,2.0,1.0,,58065-081
2348,2584545673,1100000.0,"Rua Coração de Jesus, Tambaú",144.0,4.0,,,
2349,2624580835,359500.0,"Rua Tertuliano Castro, Bessa",43.0,2.0,1.0,,58035-200
2350,2626455861,215000.0,"Rua Agostinho Fonseca Neto, Água Fria",65.0,2.0,2.0,,58073-415
2351,2613908496,340000.0,"Avenida Antônio Lira, Tambaú",30.0,1.0,1.0,,58039-010
2352,2580102000,505000.0,"Rua Francisco Carneiro de Araújo, Cabo Branco",44.0,2.0,1.0,,
2353,2628955624,418760.0,"Avenida Pombal, Manaíra",52.0,2.0,1.0,,58038-242
2354,2555930056,668713.0,"Rua José Ramalho Brunet, Cabo Branco",59.0,2.0,,2.0,58046-095
2355,2562770009,482776.0,"Rua Professora Maria Sales, Tambaú",41.0,1.0,,2.0,58045-000
2356,2637826411,355000.0,"Rua Bancário Amaury de Sousa, Jardim São Paulo",74.0,3.0,,2.0,
2357,2617646101,765000.0,"Rua Bacharel José de Oliveira Curchatuz, Aeroclube",133.0,3.0,,,58036-460
2358,2620730567,190000.0,"Cristo Redentor, João Pessoa",60.0,3.0,1.0,,
2359,2610072575,220000.0,"Cabo Branco, João Pessoa",17.0,1.0,1.0,,
2360,2602058199,175574.0,"Avenida Campos Sales, Bessa",20.0,1.0,1.0,,58035-070
2361,2621797741,285000.0,"Rua Francisco Jacinto Neto, José Américo de Almeida",80.0,3.0,2.0,,
2362,2632400522,279540.0,"Avenida Presidente Washington Luiz, Bessa",45.0,1.0,1.0,,
2363,2537339366,470000.0,"Manaíra, João Pessoa",120.0,3.0,,,
2364,2594274092,820000.0,"Avenida Campos Sales, Bessa",128.0,3.0,,,58035-070
2365,2622509242,420000.0,"Brisamar, João Pessoa",76.0,3.0,2.0,,58032-100
2366,2624415950,459519.0,"Altiplano Cabo Branco, João Pessoa",30.0,,1.0,1.0,
2367,2628948966,619110.0,"Avenida Severino Massa Spinelli, Tambaú",89.0,3.0,2.0,,
2368,2629722681,1209470.0,"Avenida João Cirilo da Silva, Altiplano Cabo Branco",110.0,3.0,,,
2369,2623705042,450000.0,"Avenida Campos Sales, Jardim Oceania",64.0,2.0,2.0,,58035-070
2370,2637965631,630000.0,"Rua Professora Maria Jacy Pinto Costa, Jardim Oceania",82.0,3.0,2.0,,
2371,2632789647,1247000.0,"Altiplano Cabo Branco, João Pessoa",127.0,3.0,,,
2372,2604828296,650000.0,"Avenida Antônio Lira, Cabo Branco",114.0,3.0,,,58045-000
2373,2571064106,500000.0,"Avenida Pombal, Manaíra",105.0,3.0,,,58038-242
2374,2638284078,480000.0,"Manaíra, João Pessoa",90.0,3.0,2.0,,
2375,2566854115,330000.0,"Rua Francisca Dantas Souza, Jardim Cidade Universitária",82.0,3.0,2.0,,58052-430
2376,2632795760,134900.0,"Industrias, João Pessoa",52.0,2.0,,1.0,
2377,2604922982,215000.0,"Rua Desportista José Eduardo de Holanda, Cabo Branco",19.0,1.0,,1.0,58046-095
2378,2629051696,680000.0,"Rua Alice Almeida, Cabo Branco",150.0,4.0,,,58046-005
2379,2635667762,680000.0,"Avenida Maria Rosa, Manaíra",130.0,3.0,,,58038-342
2380,2611312099,160000.0,"José Américo de Almeida, João Pessoa",55.0,2.0,1.0,,58071-000
2381,2629352155,325000.0,"Rua Yaya de Amorim Coutinho, Miramar",49.0,1.0,1.0,,58032-090
2382,2564445482,320000.0,"Tambauzinho, João Pessoa",51.0,2.0,1.0,,
2383,2638114679,520000.0,"Rua Fernando Luiz Henriques dos Santos, Jardim Oceania",82.0,3.0,1.0,,
2384,2630470872,225000.0,"Avenida Marechal Hermes da Fonseca, Bessa",59.0,2.0,1.0,,58036-002
2385,2562728911,299900.0,"Jardim Oceania, João Pessoa",56.0,2.0,1.0,,
2386,2628810800,200510.0,"Rua Adalgisa Luna de Menezes, Bancários",53.0,2.0,1.0,,58071-840
2387,2617419219,450000.0,"Avenida Dom Moisés Coelho, Torre",67.0,2.0,2.0,,
2388,2557878417,270000.0,"Avenida Presidente Castelo Branco, Castelo Branco",56.0,2.0,1.0,,58043-110
2389,2621496328,435000.0,"Avenida Manoel Morais, Manaíra",56.0,2.0,,2.0,58038-381
2390,2567522129,239000.0,"Rua José Duarte do Nascimento, Bancários",49.0,2.0,1.0,,
2391,2620544235,1500000.0,"Brisamar, João Pessoa",183.0,3.0,,,58032-100
2392,2637003661,414000.0,"Rua Marechal Esperidião Rosas, Expedicionários",70.0,2.0,1.0,,
2393,2617938334,295000.0,"Rua Assis Vidal, Jaguaribe",207.0,3.0,,,58015-435
2394,2634737411,550000.0,"Rua Clementina Lindoso, Altiplano Cabo Branco",72.0,2.0,2.0,,58046-095
2395,2617272916,260000.0,"Rua Tenente Francisco de Assis Moreira, Bancários",57.0,2.0,1.0,,58071-840
2396,2630998687,165000.0,"Mandacaru, João Pessoa",48.0,2.0,1.0,,
2397,2632795174,1350000.0,"Manaíra, João Pessoa",235.0,4.0,,,
2398,2561533879,359000.0,"Rua Oswaldo Evaristo da Costa, Estados",58.0,2.0,2.0,,
2399,2627289537,500000.0,"Rua João Câncio, Manaíra",84.0,1.0,1.0,,
2400,2638289516,275000.0,"Rua Desportista João Batista Freire, Bessa",52.0,2.0,1.0,,
2401,2557878648,205000.0,"Rua Alzira Coutinho de Araújo, Bancários",51.0,2.0,1.0,,58051-085
2402,2608864673,315000.0,"Rua João Vieira Carneiro, Brisamar",54.0,2.0,1.0,,
2403,2606153477,450000.0,"Rua Walter Fernandes Brandão, Aeroclube",90.0,3.0,2.0,,58036-442
2404,2434568908,485000.0,"Rua Sidney Clemente Dore, Tambaú",57.0,2.0,1.0,,58039-230
2405,2629068309,249850.0,"Rua Conselheiro José Braz do Rego, Portal do Sol",74.0,3.0,1.0,,
2406,2632793511,620000.0,"Estados, João Pessoa",102.0,3.0,,,
2407,2638283577,460600.0,"Bessa, João Pessoa",66.0,3.0,1.0,,
2408,1038340984,1500000.0,"Rua Quintino Bocaiúva, Centro",1360.0,,,,13300-035
2409,2557605389,600000.0,"Rua Silvino Lopes, Tambaú",135.0,3.0,,,58039-190
2410,2579261739,1800000.0,"Rua Agricultor Sebastião Crisóstimo da Penha, Altiplano Cabo Branco",120.0,3.0,,,
2411,2572726974,214990.0,"Cristo Redentor, João Pessoa",57.0,2.0,1.0,,
2412,2603440983,230000.0,"Avenida Tito Silva, Miramar",65.0,2.0,1.0,,58043-110
2413,2619309616,1300000.0,"Ernesto Geisel, João Pessoa",384.0,3.0,,,58075-410
2414,2626447367,630000.0,"Rua Professora Maria Jacy Pinto Costa, Jardim Oceania",85.0,3.0,2.0,,
2415,2611891189,659770.0,"Jardim Oceania, João Pessoa",77.0,3.0,1.0,,
2416,2610204727,589900.0,"Avenida Cabo Branco, Cabo Branco",77.0,2.0,1.0,,58045-000
2417,2557002363,1876908.0,"Rua Ana Guedes Vasconcelos, Altiplano Cabo Branco",160.0,3.0,,,58046-095
2418,2569377853,1209670.0,"Avenida João Cirilo da Silva, Altiplano Cabo Branco",110.0,3.0,,,
2419,2611887240,346600.0,"Bessa, João Pessoa",21.0,1.0,,1.0,
2420,2631485334,145000.0,"Rua Auto de João da Cruz, Gramame",54.0,2.0,1.0,,58065-081
2421,2613013503,265000.0,"Avenida Presidente Washington Luiz, Bessa",48.0,2.0,1.0,,
2422,2630501758,140000.0,"Jardim Universitário, Castelo Branco",60.0,1.0,1.0,,86055-645
2423,2629072620,549310.0,"Avenida Infante Dom Henrique, Tambaú",116.0,3.0,,,58039-160
2424,2567175604,140000.0,"Ernesto Geisel, João Pessoa",43.0,2.0,1.0,,58075-410
2425,2628950436,154170.0,"Rua João Sinésio da Silva, Mangabeira",43.0,2.0,1.0,,58055-018
2426,2629066288,509360.0,"Avenida Governador Argemiro de Figueiredo, Jardim Oceania",50.0,2.0,1.0,,58037-050
2427,2626926459,439900.0,"Rua Antônio Gama, Tambauzinho",79.0,3.0,1.0,,58041-110
2428,2625882556,1800000.0,"Avenida Cajazeiras, Manaíra",360.0,4.0,,,58038-250
2429,2632792921,475000.0,"Brisamar, João Pessoa",79.0,3.0,,1.0,58032-100
2430,2559675450,545000.0,"Rua Manoel Miguel de Morais, Bancários",94.0,3.0,2.0,,58051-085
2431,2611890204,750000.0,"Jardim Oceania, João Pessoa",129.0,3.0,,,
2432,2621528043,1500000.0,"Tambaú, João Pessoa",323.0,4.0,,,
2433,2620015341,500000.0,"Rua Francisco Timóteo de Souza, Anatólia",110.0,3.0,,,58052-170
2434,2604641991,185000.0,"Bancários, João Pessoa",36.0,1.0,1.0,,
2435,2554266515,120000.0,"Mangabeira, João Pessoa",52.0,2.0,1.0,,
2436,2599890968,240000.0,"Rodovia BR-230, Cristo Redentor",80.0,2.0,1.0,,
2437,2612108909,250000.0,"Avenida Presidente Epitácio Pessoa, Cabo Branco",22.0,1.0,1.0,,58045-000
2438,2629069293,2131620.0,"Rua Bancário Francisco Mendes Sobreira, Pedro Gondim",254.0,3.0,,,
2439,2637727019,170680.0,"Rua das Misericórdias, Ernesto Geisel",57.0,2.0,1.0,,58075-690
2440,2635962165,330000.0,"Rua Luciano Leal Wanderley, Valentina de Figueiredo",70.0,3.0,1.0,,58063-000
2441,2629073832,314180.0,"Rua Bancário Waldemar de Mesquita Accioly, Bancários",72.0,3.0,1.0,,58051-400
2442,2603459183,540000.0,"Avenida Presidente Café Filho, Bessa",69.0,2.0,2.0,,58035-200
2443,2635766878,182000.0,"Rua Sebastião Marcondes Ramalho Travassos, Cidade dos Colibris",56.0,2.0,1.0,,58073-314
2444,2555929165,280000.0,"Rua Carlos Barros, Miramar",54.0,2.0,,2.0,58043-110
2445,2631645162,557478.0,"Avenida Senador Ruy Carneiro, Brisamar",65.0,,,1.0,58032-090
2446,2626468261,610000.0,"Rua Escritor Ramalho Leite, Muçumagro",100.0,3.0,,,
2447,2579108139,450000.0,"José Américo de Almeida, João Pessoa",120.0,3.0,,,58071-000
2448,2629726623,450000.0,"Rua João de O. da Silva, Aeroclube",88.0,3.0,1.0,,
2449,2610445973,260000.0,"Rua Randal Cavalcante Pimentel, Bessa",60.0,2.0,1.0,,58035-200
2450,2555596101,175000.0,"Jardim Cidade Universitária, João Pessoa",34.0,1.0,1.0,,
2451,2638282171,580000.0,"Quadramares, João Pessoa",336.0,3.0,,,58052-287
2452,2619138707,225000.0,"Rua Euclides Rodrigues Oliveira, Jardim Cidade Universitária",72.0,3.0,1.0,,58052-430
2453,2632787277,1423739.0,"Miramar, João Pessoa",110.0,3.0,,,
2454,2624456085,4700000.0,"Altiplano Cabo Branco, João Pessoa",405.0,4.0,,,
2455,2617250296,850000.0,"Manaíra, João Pessoa",158.0,4.0,,,
2456,2600709562,210000.0,"Praça Estudante Orlando Geisel, Ernesto Geisel",200.0,,,,
